{
  "$schema": "../../../../schemas/visual-reference-family-generation-plan.schema.json",
  "schema_version": "1.0.0",
  "plan_id": "blue-academic-family-expansion-v1",
  "pack_id": "blue-academic",
  "status": "completed",
  "objective": "在已有三张 dominant-result 参考页之外，补齐单篇论文汇报所需的九类页面角色；每类至少生成三个独立构图候选，优秀且不重复的候选可以更多，最终形成可用于完整流程测试的蓝色学术视觉家族。",
  "anchor_image": "../contact-sheet.png",
  "output_spec": {
    "aspect_ratio": "16:9",
    "target_width_px": 1600,
    "target_height_px": 900,
    "format": "png",
    "language": "zh-CN"
  },
  "shared_prompt": "生成一张 16:9 横向中文学术汇报 PPT 视觉参考图。请把所附蓝色学术参考总览作为风格锚点：纯白背景、蓝色学术基调、现代清晰的中文无衬线字体、简约克制、适量标注、信息层级明确。延续它的审美完成度，但不要复制现有结果页的具体构图。页面中所有可见文字必须是准确的简体中文；不设置固定页脚、页码或来源区。示例图表、数值和结论可以看似真实，但必须保持语义通用，不声称是真实研究数据。请充分发挥构图和审美判断，不要把页面做成廉价商务模板，不要为了统一而强行使用卡片、图标或粗色带。该图只作为后续重建可编辑 PPT 的视觉参考，不会直接成为最终背景图。",
  "generation_policy": {
    "minimum_candidates_per_role": 3,
    "one_image_per_request": true,
    "use_anchor_image": true,
    "independent_variants": true,
    "human_review_required": true
  },
  "admission": [
    "第一眼愿意用于真实中文学术汇报",
    "与现有三张结果页属于同一视觉家族",
    "没有机械复制现有页面几何",
    "页面角色清晰且适合可编辑重建",
    "中文无明显错字、乱码或伪汉字",
    "示例内容不会诱导复制为真实研究证据"
  ],
  "roles": [
    {
      "role": "cover",
      "objective": "覆盖无图封面、抽象视觉封面和可替换主题图封面，避免把建筑、虚化照片或衬线标题固化为默认语言。",
      "variants": [
        {
          "id": "cover-01",
          "asset_geometry": "text-led",
          "example_topic": "地球科学论文汇报",
          "visible_copy": [
            "论文汇报",
            "砂岩型铀矿成矿过程中的流体—微生物耦合机制",
            "汇报人：张明",
            "地球科学学院｜2026 年 7 月"
          ],
          "task_prompt": "设计一张纯排版驱动的封面，不放照片、建筑、虚化背景或具体科研插图。长中文标题是视觉中心，用现代中文无衬线粗体；通过字号、行距、留白、细线或极少量蓝色几何关系建立完成度。元信息简洁，从属于标题。",
          "status": "selected",
          "output_file": "candidates/cover-01.png"
        },
        {
          "id": "cover-02",
          "asset_geometry": "mixed",
          "example_topic": "材料科学论文汇报",
          "visible_copy": [
            "学术论文解读",
            "界面调控提升层状正极材料的循环稳定性",
            "汇报人：李晨",
            "材料科学与工程学院｜2026 年 7 月"
          ],
          "task_prompt": "设计一张排版与抽象科学结构共同构成的封面。抽象结构应轻量、可替换、不指向具体机构或学科，例如极简网格、层状关系或微观结构线索；不得使用校园楼宇和模糊照片。标题仍是主角，抽象视觉只提供平衡和识别度。",
          "status": "selected",
          "output_file": "candidates/cover-02.png"
        },
        {
          "id": "cover-03",
          "asset_geometry": "wide",
          "example_topic": "生物医学论文汇报",
          "visible_copy": [
            "文献汇报",
            "免疫微环境重塑驱动治疗响应的动态变化",
            "汇报人：王宁",
            "生命科学学院｜2026 年 7 月"
          ],
          "task_prompt": "设计一张带可替换主题主视觉区域的封面。可以使用一块清晰、非虚化、与主题有关的显微或组织图像作为示例，但图像不超过页面主导权，不铺满背景，不做斜切楼宇效果。标题、作者信息和图像之间保持干净边界与充足留白。",
          "status": "selected",
          "output_file": "candidates/cover-03.png"
        }
      ]
    },
    {
      "role": "research-gap",
      "objective": "表达已有认识与未解决问题之间的张力，不依赖通用三卡片模板。",
      "variants": [
        {
          "id": "research-gap-01",
          "asset_geometry": "text-led",
          "example_topic": "气候变化研究",
          "visible_copy": [
            "研究空白",
            "区域增温趋势已明确，但极端事件的局地响应仍缺少统一解释",
            "已有认识：长期变化方向一致",
            "关键缺口：局地机制与时间尺度尚未贯通"
          ],
          "task_prompt": "制作以文字层级和留白为主的研究空白页。用“已有认识—关键缺口”形成清楚张力，可采用两块不对称区域、对照排版或编辑式引文关系；不要做两个相同圆角卡片。页面应有一眼可见的空白命题。",
          "status": "selected",
          "output_file": "candidates/research-gap-01.png"
        },
        {
          "id": "research-gap-02",
          "asset_geometry": "wide",
          "example_topic": "临床研究",
          "visible_copy": [
            "研究空白",
            "总体疗效改善并未解释不同患者之间的响应差异",
            "总体趋势",
            "个体差异仍然显著"
          ],
          "task_prompt": "使用一张小型、真实感但语义通用的总体趋势图作为证据，再用醒目的文字指出图表无法回答的个体差异问题。证据图约占半页以内，研究缺口必须比图表装饰更清楚；允许少量标注，不虚构样本量或显著性。",
          "status": "selected",
          "output_file": "candidates/research-gap-02.png"
        },
        {
          "id": "research-gap-03",
          "asset_geometry": "flow",
          "example_topic": "能源材料研究",
          "visible_copy": [
            "研究空白",
            "高容量与长寿命为何难以同时实现？",
            "已知：容量随活性位点增加而提升",
            "矛盾：结构失稳加速容量衰减",
            "待解：界面过程如何连接二者"
          ],
          "task_prompt": "用“已知事实—观测矛盾—待解决问题”的研究逻辑组织页面。可以是横向递进、断裂链或上下转折，不要画成商业流程图。最终问题必须成为视觉落点，允许使用少量蓝色和一处警示色。",
          "status": "selected",
          "output_file": "candidates/research-gap-03.png"
        },
        {
          "id": "research-gap-04",
          "asset_geometry": "mixed",
          "example_topic": "临床研究空白",
          "visible_copy": [
            "研究空白",
            "总体疗效改善并未解释不同患者之间的响应差异",
            "总体趋势持续改善",
            "个体差异仍然显著",
            "哪些因素驱动了这种差异？"
          ],
          "task_prompt": "设计一张额外的研究空白候选页。左侧使用总体趋势证据，右侧用短问题清单或轻量引文指出个体差异无法被平均趋势解释。允许一处红色警示，但保持蓝白体系和大留白，不做厚重卡片。",
          "status": "selected",
          "output_file": "candidates/research-gap-04.png"
        }
      ]
    },
    {
      "role": "research-question",
      "objective": "把研究问题、子问题和可验证假设组织成可讲述的页面，而不是目录页。",
      "variants": [
        {
          "id": "research-question-01",
          "asset_geometry": "text-led",
          "example_topic": "生态学研究",
          "visible_copy": [
            "研究问题",
            "多重环境压力如何共同改变群落稳定性？",
            "压力是否产生协同效应？",
            "不同群落的响应是否一致？",
            "哪些指标最早出现转折？"
          ],
          "task_prompt": "以一个大号核心问题为中心，三个子问题在视觉上从属于它。页面主要依靠排版和空间关系，不要使用三个等权卡片或大量问号图标。让观众能迅速看出主问题与子问题的层级。",
          "status": "selected",
          "output_file": "candidates/research-question-01.png"
        },
        {
          "id": "research-question-02",
          "asset_geometry": "network",
          "example_topic": "计算机视觉研究",
          "visible_copy": [
            "研究问题",
            "几何约束如何提升复杂场景中的定位可靠性？",
            "场景干扰",
            "特征一致性",
            "定位误差"
          ],
          "task_prompt": "围绕核心问题表达三个变量之间的关系。使用克制的节点、连线、方向或空间距离，而不是炫技网络图；标题和问题仍要先被看到。图形关系应可用 PowerPoint 原生形状重建。",
          "status": "selected",
          "output_file": "candidates/research-question-02.png"
        },
        {
          "id": "research-question-03",
          "asset_geometry": "flow",
          "example_topic": "社会科学研究",
          "visible_copy": [
            "研究假设",
            "信息透明度提升将增强公众信任",
            "假设一：信息质量影响风险判断",
            "假设二：制度信任调节该关系",
            "验证路径：问卷、实验与行为数据"
          ],
          "task_prompt": "把核心假设与可验证证据路径放在一张页面上。可以使用上下结构或从命题到验证的轻量关系，不要画成项目管理流程图。突出假设与证据之间的对应，而不是强调装饰。",
          "status": "selected",
          "output_file": "candidates/research-question-03.png"
        }
      ]
    },
    {
      "role": "method-design",
      "objective": "覆盖一般研究流程、样本设计和分析管线三种常见方法几何。",
      "variants": [
        {
          "id": "method-design-01",
          "asset_geometry": "flow",
          "example_topic": "地质学研究",
          "visible_copy": [
            "研究方法",
            "从野外观察到成矿机制解释的完整证据链",
            "样品采集",
            "矿物与地球化学分析",
            "同位素约束",
            "综合机制解释"
          ],
          "task_prompt": "设计横向科学研究流程。四个阶段应有清晰次序和不同信息权重，但不要使用彩色图标、发光箭头或胶囊按钮。允许使用简洁照片缩略图或几何占位来表达材料类型，整体像论文方法框架的演示化重构。",
          "status": "selected",
          "output_file": "candidates/method-design-01.png"
        },
        {
          "id": "method-design-02",
          "asset_geometry": "mixed",
          "example_topic": "临床样本设计",
          "visible_copy": [
            "研究设计",
            "多阶段样本设计支持疗效与机制的联合评估",
            "初始队列",
            "分组干预",
            "纵向随访",
            "多组学检测"
          ],
          "task_prompt": "设计一张样本或队列研究设计页。清楚表现样本如何分组、随访和进入后续分析，可采用漏斗、分支或时间结构；不要像企业组织架构。数字可以是通用示例，但不要添加真实临床声明或统计结论。",
          "status": "selected",
          "output_file": "candidates/method-design-02.png"
        },
        {
          "id": "method-design-03",
          "asset_geometry": "flow",
          "example_topic": "材料数据分析",
          "visible_copy": [
            "分析流程",
            "多源表征与模型分析共同识别关键结构因素",
            "实验表征输入",
            "特征提取与融合",
            "模型训练与验证",
            "结构—性能解释"
          ],
          "task_prompt": "设计输入—处理—输出型分析管线，突出多源数据在中部汇聚并输出可解释结论。允许模型发挥图形语言，但应保持学术、可编辑、易讲述；避免黑盒科技感、代码界面和过多小模块。",
          "status": "selected",
          "output_file": "candidates/method-design-03.png"
        }
      ]
    },
    {
      "role": "comparison",
      "objective": "覆盖平衡双图、多条件共享尺度和总览—细节三种比较方式。",
      "variants": [
        {
          "id": "comparison-01",
          "asset_geometry": "balanced-pair",
          "example_topic": "材料显微结构",
          "visible_copy": [
            "结构对比",
            "界面调控显著减少了循环后的局部结构破坏",
            "对照样品",
            "改性样品",
            "结构连续性得到保持"
          ],
          "task_prompt": "设计两张等权显微或表征图的并列比较页。两图大小、基线和标注方式一致，只用一两处克制标记指出差异。不要使用巨大对勾叉号，也不要把两图装进厚重卡片。",
          "status": "selected",
          "output_file": "candidates/comparison-01.png"
        },
        {
          "id": "comparison-02",
          "asset_geometry": "wide",
          "example_topic": "算法性能比较",
          "visible_copy": [
            "方法比较",
            "所提方法在三类干扰条件下均保持更低误差",
            "弱纹理",
            "动态遮挡",
            "尺度变化",
            "误差变化趋势"
          ],
          "task_prompt": "设计共享坐标或严格对齐的三条件比较页。可以采用一张组合图或三个共享尺度的小图，但要让横向比较一眼成立。保持图表真实感和简洁标注，不堆叠大量说明。",
          "status": "selected",
          "output_file": "candidates/comparison-02.png"
        },
        {
          "id": "comparison-03",
          "asset_geometry": "mixed",
          "example_topic": "医学影像分析",
          "visible_copy": [
            "局部差异",
            "整体改善主要来自病灶边缘区域的识别提升",
            "全局结果",
            "关键区域放大",
            "边缘误差明显减少"
          ],
          "task_prompt": "设计“全局结果—局部放大”或“基线—改进细节”的比较构图。一张图提供上下文，另一张图突出关键局部；用细线、放大框或标记建立关系。避免把两个对象机械地五五分栏。",
          "status": "selected",
          "output_file": "candidates/comparison-03.png"
        }
      ]
    },
    {
      "role": "multi-panel",
      "objective": "覆盖均衡四面板、主面板带支持证据和横向证据序列。",
      "variants": [
        {
          "id": "multi-panel-01",